{
  "$schema": "./blueprint-schema.json",
  "meta": {
    "title": "Default FacturaScripts Playground Blueprint",
    "author": "facturascripts-playground",
    "description": "Baseline browser blueprint for FacturaScripts Playground."
  },
  "debug": {
    "enabled": false
  },
  "landingPage": "/",
  "siteOptions": {
    "title": "FacturaScripts Playground",
    "locale": "es_ES",
    "timezone": "Europe/Madrid"
  },
  "login": {
    "username": "admin",
    "password": "admin"
  },
  "plugins": [],
  "seed": {
    "customers": [],
    "suppliers": [],
    "products": []
  },
  "install": {
    "codpais": "ESP",
    "empresa": "Empresa Playground",
    "cifnif": "00000014Z",
    "tipoidfiscal": "",
    "direccion": "",
    "codpostal": "",
    "ciudad": "",
    "provincia": "",
    "regimeniva": "General",
    "codimpuesto": "",
    "defaultplan": true,
    "costpricepolicy": "",
    "ventasinstock": false,
    "updatesupplierprices": true
  },
  "settings": {}
}
