{
  "$schema": "./assets/blueprints/blueprint-schema.json",
  "meta": {
    "title": "FacturaScripts Playground Blueprint Sample",
    "author": "facturascripts-playground",
    "description": "Ejemplo de blueprint para FacturaScripts Playground con CommandPalette y datos demo."
  },
  "debug": {
    "enabled": false
  },
  "landingPage": "/AdminPlugins",
  "siteOptions": {
    "title": "FacturaScripts Playground Demo",
    "locale": "es_ES",
    "timezone": "Europe/Madrid"
  },
  "login": {
    "username": "admin",
    "password": "admin"
  },
  "plugins": [
    "https://facturascripts.com/plugins/commandpalette"
  ],
  "seed": {
    "customers": [
      {
        "codcliente": "CDEMO1",
        "nombre": "Cliente Demo",
        "cifnif": "12345678Z",
        "email": "cliente@example.com",
        "telefono1": "+34910000001",
        "direccion": "Calle Demo 1",
        "ciudad": "Madrid",
        "provincia": "Madrid",
        "codpais": "ESP"
      }
    ],
    "suppliers": [
      {
        "codproveedor": "PDEMO1",
        "nombre": "Proveedor Demo",
        "cifnif": "B12345678",
        "email": "proveedor@example.com",
        "telefono1": "+34910000002"
      }
    ],
    "products": [
      {
        "referencia": "SKU-DEMO-001",
        "descripcion": "Producto demo",
        "precio": 19.95,
        "stockfis": 25
      }
    ]
  }
}
